{
  "schemaVersion": 1,
  "packVersion": "0.1.78+21",
  "tokenizer": "estimate: chars/3.5",
  "files": [
    {
      "path": "components/accordion.brief.md",
      "bytes": 2941,
      "tokens": 840,
      "estimated": true
    },
    {
      "path": "components/accordion.json",
      "bytes": 20366,
      "tokens": 5817,
      "estimated": true
    },
    {
      "path": "components/accordion.links.md",
      "bytes": 358,
      "tokens": 98,
      "estimated": true
    },
    {
      "path": "components/accordion.md",
      "bytes": 15001,
      "tokens": 4240,
      "estimated": true
    },
    {
      "path": "components/accordioncheckbox.brief.md",
      "bytes": 3931,
      "tokens": 1121,
      "estimated": true
    },
    {
      "path": "components/accordioncheckbox.json",
      "bytes": 25088,
      "tokens": 7153,
      "estimated": true
    },
    {
      "path": "components/accordioncheckbox.links.md",
      "bytes": 468,
      "tokens": 129,
      "estimated": true
    },
    {
      "path": "components/accordioncheckbox.md",
      "bytes": 19321,
      "tokens": 5454,
      "estimated": true
    },
    {
      "path": "components/accountcard.brief.md",
      "bytes": 2972,
      "tokens": 845,
      "estimated": true
    },
    {
      "path": "components/accountcard.json",
      "bytes": 24708,
      "tokens": 7041,
      "estimated": true
    },
    {
      "path": "components/accountcard.links.md",
      "bytes": 434,
      "tokens": 120,
      "estimated": true
    },
    {
      "path": "components/accountcard.md",
      "bytes": 17505,
      "tokens": 4936,
      "estimated": true
    },
    {
      "path": "components/actionfooter.brief.md",
      "bytes": 2880,
      "tokens": 823,
      "estimated": true
    },
    {
      "path": "components/actionfooter.json",
      "bytes": 23331,
      "tokens": 6663,
      "estimated": true
    },
    {
      "path": "components/actionfooter.links.md",
      "bytes": 521,
      "tokens": 141,
      "estimated": true
    },
    {
      "path": "components/actionfooter.md",
      "bytes": 17440,
      "tokens": 4924,
      "estimated": true
    },
    {
      "path": "components/actiontile.brief.md",
      "bytes": 2702,
      "tokens": 772,
      "estimated": true
    },
    {
      "path": "components/actiontile.json",
      "bytes": 18438,
      "tokens": 5265,
      "estimated": true
    },
    {
      "path": "components/actiontile.links.md",
      "bytes": 349,
      "tokens": 96,
      "estimated": true
    },
    {
      "path": "components/actiontile.md",
      "bytes": 13151,
      "tokens": 3709,
      "estimated": true
    },
    {
      "path": "components/amountinput.brief.md",
      "bytes": 3590,
      "tokens": 1024,
      "estimated": true
    },
    {
      "path": "components/amountinput.json",
      "bytes": 18900,
      "tokens": 5394,
      "estimated": true
    },
    {
      "path": "components/amountinput.links.md",
      "bytes": 447,
      "tokens": 122,
      "estimated": true
    },
    {
      "path": "components/amountinput.md",
      "bytes": 14804,
      "tokens": 4176,
      "estimated": true
    },
    {
      "path": "components/appbar.brief.md",
      "bytes": 3604,
      "tokens": 1030,
      "estimated": true
    },
    {
      "path": "components/appbar.json",
      "bytes": 26735,
      "tokens": 7638,
      "estimated": true
    },
    {
      "path": "components/appbar.links.md",
      "bytes": 389,
      "tokens": 106,
      "estimated": true
    },
    {
      "path": "components/appbar.md",
      "bytes": 20043,
      "tokens": 5674,
      "estimated": true
    },
    {
      "path": "components/arealinechart.brief.md",
      "bytes": 3226,
      "tokens": 922,
      "estimated": true
    },
    {
      "path": "components/arealinechart.json",
      "bytes": 26438,
      "tokens": 7554,
      "estimated": true
    },
    {
      "path": "components/arealinechart.links.md",
      "bytes": 320,
      "tokens": 89,
      "estimated": true
    },
    {
      "path": "components/arealinechart.md",
      "bytes": 18516,
      "tokens": 5242,
      "estimated": true
    },
    {
      "path": "components/attached.brief.md",
      "bytes": 2586,
      "tokens": 738,
      "estimated": true
    },
    {
      "path": "components/attached.json",
      "bytes": 17169,
      "tokens": 4902,
      "estimated": true
    },
    {
      "path": "components/attached.links.md",
      "bytes": 292,
      "tokens": 81,
      "estimated": true
    },
    {
      "path": "components/attached.md",
      "bytes": 12956,
      "tokens": 3663,
      "estimated": true
    },
    {
      "path": "components/autoplaycontrol.brief.md",
      "bytes": 2649,
      "tokens": 753,
      "estimated": true
    },
    {
      "path": "components/autoplaycontrol.json",
      "bytes": 14476,
      "tokens": 4116,
      "estimated": true
    },
    {
      "path": "components/autoplaycontrol.links.md",
      "bytes": 383,
      "tokens": 107,
      "estimated": true
    },
    {
      "path": "components/autoplaycontrol.md",
      "bytes": 11141,
      "tokens": 3128,
      "estimated": true
    },
    {
      "path": "components/avatar.brief.md",
      "bytes": 2571,
      "tokens": 734,
      "estimated": true
    },
    {
      "path": "components/avatar.json",
      "bytes": 17798,
      "tokens": 5080,
      "estimated": true
    },
    {
      "path": "components/avatar.links.md",
      "bytes": 596,
      "tokens": 158,
      "estimated": true
    },
    {
      "path": "components/avatar.md",
      "bytes": 13273,
      "tokens": 3753,
      "estimated": true
    },
    {
      "path": "components/avatargroup.brief.md",
      "bytes": 2910,
      "tokens": 831,
      "estimated": true
    },
    {
      "path": "components/avatargroup.json",
      "bytes": 17186,
      "tokens": 4904,
      "estimated": true
    },
    {
      "path": "components/avatargroup.links.md",
      "bytes": 418,
      "tokens": 114,
      "estimated": true
    },
    {
      "path": "components/avatargroup.md",
      "bytes": 13291,
      "tokens": 3752,
      "estimated": true
    },
    {
      "path": "components/badge.brief.md",
      "bytes": 2381,
      "tokens": 680,
      "estimated": true
    },
    {
      "path": "components/badge.json",
      "bytes": 20247,
      "tokens": 5784,
      "estimated": true
    },
    {
      "path": "components/badge.links.md",
      "bytes": 448,
      "tokens": 119,
      "estimated": true
    },
    {
      "path": "components/badge.md",
      "bytes": 14357,
      "tokens": 4052,
      "estimated": true
    },
    {
      "path": "components/balance.brief.md",
      "bytes": 2960,
      "tokens": 844,
      "estimated": true
    },
    {
      "path": "components/balance.json",
      "bytes": 18563,
      "tokens": 5282,
      "estimated": true
    },
    {
      "path": "components/balance.links.md",
      "bytes": 465,
      "tokens": 126,
      "estimated": true
    },
    {
      "path": "components/balance.md",
      "bytes": 13294,
      "tokens": 3731,
      "estimated": true
    },
    {
      "path": "components/benefitcard.brief.md",
      "bytes": 2953,
      "tokens": 842,
      "estimated": true
    },
    {
      "path": "components/benefitcard.json",
      "bytes": 33376,
      "tokens": 9524,
      "estimated": true
    },
    {
      "path": "components/benefitcard.links.md",
      "bytes": 235,
      "tokens": 67,
      "estimated": true
    },
    {
      "path": "components/benefitcard.md",
      "bytes": 23074,
      "tokens": 6538,
      "estimated": true
    },
    {
      "path": "components/bottomnav.brief.md",
      "bytes": 2815,
      "tokens": 804,
      "estimated": true
    },
    {
      "path": "components/bottomnav.json",
      "bytes": 17718,
      "tokens": 5062,
      "estimated": true
    },
    {
      "path": "components/bottomnav.links.md",
      "bytes": 322,
      "tokens": 89,
      "estimated": true
    },
    {
      "path": "components/bottomnav.md",
      "bytes": 13163,
      "tokens": 3708,
      "estimated": true
    },
    {
      "path": "components/brandchip.brief.md",
      "bytes": 3003,
      "tokens": 853,
      "estimated": true
    },
    {
      "path": "components/brandchip.json",
      "bytes": 21559,
      "tokens": 6144,
      "estimated": true
    },
    {
      "path": "components/brandchip.links.md",
      "bytes": 354,
      "tokens": 97,
      "estimated": true
    },
    {
      "path": "components/brandchip.md",
      "bytes": 15669,
      "tokens": 4413,
      "estimated": true
    },
    {
      "path": "components/breadcrumbs.brief.md",
      "bytes": 3451,
      "tokens": 986,
      "estimated": true
    },
    {
      "path": "components/breadcrumbs.json",
      "bytes": 25607,
      "tokens": 7314,
      "estimated": true
    },
    {
      "path": "components/breadcrumbs.links.md",
      "bytes": 235,
      "tokens": 67,
      "estimated": true
    },
    {
      "path": "components/breadcrumbs.md",
      "bytes": 18278,
      "tokens": 5182,
      "estimated": true
    },
    {
      "path": "components/button.brief.md",
      "bytes": 2846,
      "tokens": 812,
      "estimated": true
    },
    {
      "path": "components/button.json",
      "bytes": 28032,
      "tokens": 7988,
      "estimated": true
    },
    {
      "path": "components/button.links.md",
      "bytes": 1819,
      "tokens": 468,
      "estimated": true
    },
    {
      "path": "components/button.md",
      "bytes": 19453,
      "tokens": 5487,
      "estimated": true
    },
    {
      "path": "components/buttongroup.brief.md",
      "bytes": 2391,
      "tokens": 682,
      "estimated": true
    },
    {
      "path": "components/buttongroup.json",
      "bytes": 15610,
      "tokens": 4449,
      "estimated": true
    },
    {
      "path": "components/buttongroup.links.md",
      "bytes": 478,
      "tokens": 130,
      "estimated": true
    },
    {